{
 "_note": "v3.8 world index: every file the loader reads, plus the start position. status reference = generated by build/world/world_gen.py (replace with authored maps); authored = hand-made.",
 "schema": "index/0.3",
 "version": "v3.9.2",
 "renames": {},
 "start": {
  "graph": "realm_1",
  "node": "village"
 },
 "files": {
  "rules": "world_rules.json",
  "zones": "zones.json",
  "quests": "quests_world.json",
  "layoutTargets": "layout_targets.json"
 },
 "content": {
  "3": "content/realm_3.json",
  "4": "content/realm_4.json",
  "5": "content/realm_5.json",
  "6": "content/realm_6.json",
  "7": "content/realm_7.json",
  "8": "content/realm_8.json",
  "9": "content/realm_9.json"
 },
 "graphs": [
  {
   "id": "bazaar_cellars_1",
   "kind": "dungeon_level",
   "realm": 3,
   "dungeon": "bazaar_cellars",
   "level": 1,
   "status": "reference",
   "nodes": 14,
   "file": "graphs/bazaar_cellars_1.json"
  },
  {
   "id": "beast_pens_1",
   "kind": "dungeon_level",
   "realm": 8,
   "dungeon": "beast_pens",
   "level": 1,
   "status": "reference",
   "nodes": 20,
   "file": "graphs/beast_pens_1.json"
  },
  {
   "id": "beast_pens_2",
   "kind": "dungeon_level",
   "realm": 8,
   "dungeon": "beast_pens",
   "level": 2,
   "status": "reference",
   "nodes": 4,
   "file": "graphs/beast_pens_2.json"
  },
  {
   "id": "cloud_caves_1",
   "kind": "dungeon_level",
   "realm": 7,
   "dungeon": "cloud_caves",
   "level": 1,
   "status": "reference",
   "nodes": 23,
   "file": "graphs/cloud_caves_1.json"
  },
  {
   "id": "demon_castle_1",
   "kind": "dungeon_level",
   "realm": 9,
   "dungeon": "demon_castle",
   "level": 1,
   "status": "reference",
   "nodes": 41,
   "file": "graphs/demon_castle_1.json"
  },
  {
   "id": "demon_castle_2",
   "kind": "dungeon_level",
   "realm": 9,
   "dungeon": "demon_castle",
   "level": 2,
   "status": "reference",
   "nodes": 25,
   "file": "graphs/demon_castle_2.json"
  },
  {
   "id": "demon_castle_3",
   "kind": "dungeon_level",
   "realm": 9,
   "dungeon": "demon_castle",
   "level": 3,
   "status": "reference",
   "nodes": 26,
   "file": "graphs/demon_castle_3.json"
  },
  {
   "id": "demon_castle_4",
   "kind": "dungeon_level",
   "realm": 9,
   "dungeon": "demon_castle",
   "level": 4,
   "status": "reference",
   "nodes": 12,
   "file": "graphs/demon_castle_4.json"
  },
  {
   "id": "demon_castle_5",
   "kind": "dungeon_level",
   "realm": 9,
   "dungeon": "demon_castle",
   "level": 5,
   "status": "reference",
   "nodes": 9,
   "file": "graphs/demon_castle_5.json"
  },
  {
   "id": "goblin_caves_1",
   "kind": "dungeon_level",
   "realm": 4,
   "dungeon": "goblin_caves",
   "level": 1,
   "status": "reference",
   "nodes": 21,
   "file": "graphs/goblin_caves_1.json"
  },
  {
   "id": "goblin_caves_2",
   "kind": "dungeon_level",
   "realm": 4,
   "dungeon": "goblin_caves",
   "level": 2,
   "status": "reference",
   "nodes": 15,
   "file": "graphs/goblin_caves_2.json"
  },
  {
   "id": "goblin_caves_3",
   "kind": "dungeon_level",
   "realm": 4,
   "dungeon": "goblin_caves",
   "level": 3,
   "status": "reference",
   "nodes": 19,
   "file": "graphs/goblin_caves_3.json"
  },
  {
   "id": "great_hive_1",
   "kind": "dungeon_level",
   "realm": 2,
   "dungeon": "great_hive",
   "level": 1,
   "status": "reference",
   "nodes": 13,
   "file": "graphs/great_hive_1.json"
  },
  {
   "id": "griffin_spire_1",
   "kind": "dungeon_level",
   "realm": 7,
   "dungeon": "griffin_spire",
   "level": 1,
   "status": "reference",
   "nodes": 10,
   "file": "graphs/griffin_spire_1.json"
  },
  {
   "id": "griffin_spire_2",
   "kind": "dungeon_level",
   "realm": 7,
   "dungeon": "griffin_spire",
   "level": 2,
   "status": "reference",
   "nodes": 15,
   "file": "graphs/griffin_spire_2.json"
  },
  {
   "id": "griffin_spire_3",
   "kind": "dungeon_level",
   "realm": 7,
   "dungeon": "griffin_spire",
   "level": 3,
   "status": "reference",
   "nodes": 7,
   "file": "graphs/griffin_spire_3.json"
  },
  {
   "id": "hydra_lair_1",
   "kind": "dungeon_level",
   "realm": 5,
   "dungeon": "hydra_lair",
   "level": 1,
   "status": "reference",
   "nodes": 33,
   "file": "graphs/hydra_lair_1.json"
  },
  {
   "id": "hydra_lair_2",
   "kind": "dungeon_level",
   "realm": 5,
   "dungeon": "hydra_lair",
   "level": 2,
   "status": "reference",
   "nodes": 13,
   "file": "graphs/hydra_lair_2.json"
  },
  {
   "id": "moonlit_crypt_1",
   "kind": "dungeon_level",
   "realm": 6,
   "dungeon": "moonlit_crypt",
   "level": 1,
   "status": "reference",
   "nodes": 11,
   "file": "graphs/moonlit_crypt_1.json"
  },
  {
   "id": "moonlit_crypt_2",
   "kind": "dungeon_level",
   "realm": 6,
   "dungeon": "moonlit_crypt",
   "level": 2,
   "status": "reference",
   "nodes": 45,
   "file": "graphs/moonlit_crypt_2.json"
  },
  {
   "id": "old_mine_1",
   "kind": "dungeon_level",
   "realm": 6,
   "dungeon": "old_mine",
   "level": 1,
   "status": "reference",
   "nodes": 13,
   "file": "graphs/old_mine_1.json"
  },
  {
   "id": "realm_1",
   "kind": "overworld",
   "realm": 1,
   "dungeon": null,
   "level": 0,
   "status": "authored",
   "nodes": 17,
   "file": "graphs/realm_1.json"
  },
  {
   "id": "realm_2",
   "kind": "overworld",
   "realm": 2,
   "dungeon": null,
   "level": 0,
   "status": "reference",
   "nodes": 12,
   "file": "graphs/realm_2.json"
  },
  {
   "id": "realm_3",
   "kind": "overworld",
   "realm": 3,
   "dungeon": null,
   "level": 0,
   "status": "reference",
   "nodes": 27,
   "file": "graphs/realm_3.json"
  },
  {
   "id": "realm_4",
   "kind": "overworld",
   "realm": 4,
   "dungeon": null,
   "level": 0,
   "status": "reference",
   "nodes": 5,
   "file": "graphs/realm_4.json"
  },
  {
   "id": "realm_5",
   "kind": "overworld",
   "realm": 5,
   "dungeon": null,
   "level": 0,
   "status": "reference",
   "nodes": 34,
   "file": "graphs/realm_5.json"
  },
  {
   "id": "realm_6",
   "kind": "overworld",
   "realm": 6,
   "dungeon": null,
   "level": 0,
   "status": "reference",
   "nodes": 37,
   "file": "graphs/realm_6.json"
  },
  {
   "id": "realm_7",
   "kind": "overworld",
   "realm": 7,
   "dungeon": null,
   "level": 0,
   "status": "reference",
   "nodes": 75,
   "file": "graphs/realm_7.json"
  },
  {
   "id": "realm_8",
   "kind": "overworld",
   "realm": 8,
   "dungeon": null,
   "level": 0,
   "status": "reference",
   "nodes": 91,
   "file": "graphs/realm_8.json"
  },
  {
   "id": "realm_9",
   "kind": "overworld",
   "realm": 9,
   "dungeon": null,
   "level": 0,
   "status": "reference",
   "nodes": 48,
   "file": "graphs/realm_9.json"
  },
  {
   "id": "shadow_vault_1",
   "kind": "dungeon_level",
   "realm": 9,
   "dungeon": "shadow_vault",
   "level": 1,
   "status": "reference",
   "nodes": 21,
   "file": "graphs/shadow_vault_1.json"
  },
  {
   "id": "shadow_vault_2",
   "kind": "dungeon_level",
   "realm": 9,
   "dungeon": "shadow_vault",
   "level": 2,
   "status": "reference",
   "nodes": 19,
   "file": "graphs/shadow_vault_2.json"
  },
  {
   "id": "undercroft_1",
   "kind": "dungeon_level",
   "realm": 8,
   "dungeon": "undercroft",
   "level": 1,
   "status": "reference",
   "nodes": 16,
   "file": "graphs/undercroft_1.json"
  },
  {
   "id": "undercroft_2",
   "kind": "dungeon_level",
   "realm": 8,
   "dungeon": "undercroft",
   "level": 2,
   "status": "reference",
   "nodes": 17,
   "file": "graphs/undercroft_2.json"
  },
  {
   "id": "undercroft_3",
   "kind": "dungeon_level",
   "realm": 8,
   "dungeon": "undercroft",
   "level": 3,
   "status": "reference",
   "nodes": 17,
   "file": "graphs/undercroft_3.json"
  },
  {
   "id": "world",
   "kind": "world",
   "realm": null,
   "dungeon": null,
   "level": 0,
   "status": "authored",
   "nodes": 9,
   "file": "graphs/world.json"
  }
 ]
}
